{
  "$schema": "https://json-schema.org/draft/2020-12/schema",
  "$id": "https://pokerogue-sbc.local/schema/moves-catalog.schema.v1.json",
  "title": "Moves Catalog Schema v1",
  "type": "object",
  "additionalProperties": false,
  "required": [
    "schema_version",
    "generated_from",
    "generated_at",
    "items"
  ],
  "properties": {
    "schema_version": {
      "const": 1
    },
    "generated_from": {
      "type": "string",
      "const": "dependency/pokerogue"
    },
    "generated_at": {
      "type": "string",
      "format": "date-time"
    },
    "items": {
      "type": "array",
      "items": {
        "$ref": "moves.schema.v1.json"
      }
    }
  }
}
