{
  "schema_version": 1,
  "generated_from": "dependency/pokerogue",
  "generated_at": "2026-07-01T03:56:12.946432+00:00",
  "items": [
    {
      "schema_version": 1,
      "species_id": "BULBASAUR",
      "pokedex_number": 1,
      "name": "Bulbasaur",
      "types": [
        "GRASS",
        "POISON"
      ],
      "base_stats": {
        "hp": 45,
        "atk": 49,
        "def": 49,
        "sp_atk": 65,
        "sp_def": 65,
        "spd": 45
      },
      "source": {
        "repo": "dependency/pokerogue",
        "species_enum_name": "BULBASAUR",
        "generation": 1,
        "form_key": "DEFAULT"
      },
      "catch_rate": 45,
      "base_friendship": 50,
      "base_exp": 64,
      "growth_rate": "MEDIUM_SLOW"
    },
    {
      "schema_version": 1,
      "species_id": "IVYSAUR",
      "pokedex_number": 2,
      "name": "Ivysaur",
      "types": [
        "GRASS",
        "POISON"
      ],
      "base_stats": {
        "hp": 60,
        "atk": 62,
        "def": 63,
        "sp_atk": 80,
        "sp_def": 80,
        "spd": 60
      },
      "source": {
        "repo": "dependency/pokerogue",
        "species_enum_name": "IVYSAUR",
        "generation": 1,
        "form_key": "DEFAULT"
      },
      "catch_rate": 45,
      "base_friendship": 50,
      "base_exp": 142,
      "growth_rate": "MEDIUM_SLOW"
    },
    {
      "schema_version": 1,
      "species_id": "VENUSAUR",
      "pokedex_number": 3,
      "name": "Venusaur",
      "types": [
        "GRASS",
        "POISON"
      ],
      "base_stats": {
        "hp": 80,
        "atk": 82,
        "def": 83,
        "sp_atk": 100,
        "sp_def": 100,
        "spd": 80
      },
      "source": {
        "repo": "dependency/pokerogue",
        "species_enum_name": "VENUSAUR",
        "generation": 1,
        "form_key": "DEFAULT"
      },
      "catch_rate": 45,
      "base_friendship": 50,
      "base_exp": 263,
      "growth_rate": "MEDIUM_SLOW"
    },
    {
      "schema_version": 1,
      "species_id": "CHARMANDER",
      "pokedex_number": 4,
      "name": "Charmander",
      "types": [
        "FIRE"
      ],
      "base_stats": {
        "hp": 39,
        "atk": 52,
        "def": 43,
        "sp_atk": 60,
        "sp_def": 50,
        "spd": 65
      },
      "source": {
        "repo": "dependency/pokerogue",
        "species_enum_name": "CHARMANDER",
        "generation": 1,
        "form_key": "DEFAULT"
      },
      "catch_rate": 45,
      "base_friendship": 50,
      "base_exp": 62,
      "growth_rate": "MEDIUM_SLOW"
    },
    {
      "schema_version": 1,
      "species_id": "CHARMELEON",
      "pokedex_number": 5,
      "name": "Charmeleon",
      "types": [
        "FIRE"
      ],
      "base_stats": {
        "hp": 58,
        "atk": 64,
        "def": 58,
        "sp_atk": 80,
        "sp_def": 65,
        "spd": 80
      },
      "source": {
        "repo": "dependency/pokerogue",
        "species_enum_name": "CHARMELEON",
        "generation": 1,
        "form_key": "DEFAULT"
      },
      "catch_rate": 45,
      "base_friendship": 50,
      "base_exp": 142,
      "growth_rate": "MEDIUM_SLOW"
    },
    {
      "schema_version": 1,
      "species_id": "CHARIZARD",
      "pokedex_number": 6,
      "name": "Charizard",
      "types": [
        "FIRE",
        "FLYING"
      ],
      "base_stats": {
        "hp": 78,
        "atk": 84,
        "def": 78,
        "sp_atk": 109,
        "sp_def": 85,
        "spd": 100
      },
      "source": {
        "repo": "dependency/pokerogue",
        "species_enum_name": "CHARIZARD",
        "generation": 1,
        "form_key": "DEFAULT"
      },
      "catch_rate": 45,
      "base_friendship": 50,
      "base_exp": 267,
      "growth_rate": "MEDIUM_SLOW"
    },
    {
      "schema_version": 1,
      "species_id": "SQUIRTLE",
      "pokedex_number": 7,
      "name": "Squirtle",
      "types": [
        "WATER"
      ],
      "base_stats": {
        "hp": 44,
        "atk": 48,
        "def": 65,
        "sp_atk": 50,
        "sp_def": 64,
        "spd": 43
      },
      "source": {
        "repo": "dependency/pokerogue",
        "species_enum_name": "SQUIRTLE",
        "generation": 1,
        "form_key": "DEFAULT"
      },
      "catch_rate": 45,
      "base_friendship": 50,
      "base_exp": 63,
      "growth_rate": "MEDIUM_SLOW"
    },
    {
      "schema_version": 1,
      "species_id": "WARTORTLE",
      "pokedex_number": 8,
      "name": "Wartortle",
      "types": [
        "WATER"
      ],
      "base_stats": {
        "hp": 59,
        "atk": 63,
        "def": 80,
        "sp_atk": 65,
        "sp_def": 80,
        "spd": 58
      },
      "source": {
        "repo": "dependency/pokerogue",
        "species_enum_name": "WARTORTLE",
        "generation": 1,
        "form_key": "DEFAULT"
      },
      "catch_rate": 45,
      "base_friendship": 50,
      "base_exp": 142,
      "growth_rate": "MEDIUM_SLOW"
    },
    {
      "schema_version": 1,
      "species_id": "BLASTOISE",
      "pokedex_number": 9,
      "name": "Blastoise",
      "types": [
        "WATER"
      ],
      "base_stats": {
        "hp": 79,
        "atk": 83,
        "def": 100,
        "sp_atk": 85,
        "sp_def": 105,
        "spd": 78
      },
      "source": {
        "repo": "dependency/pokerogue",
        "species_enum_name": "BLASTOISE",
        "generation": 1,
        "form_key": "DEFAULT"
      },
      "catch_rate": 45,
      "base_friendship": 50,
      "base_exp": 265,
      "growth_rate": "MEDIUM_SLOW"
    }
  ]
}